id,name,comment,rating,review_date
1,Jaime Arrieta,"Sin duda, Christian, el mejor asistente que hay. Todos los días con una sonrisa esperándote en la entrada. Hace que la experiencia de venir a entrenar todos los días sea mejor, y su especialidad sin duda es el trato con la gente. Su humor, su cercanía y su amabilidad sobretodo es excepcional. Se agradece mucho tener a alguien como Christian. El mejor!💪😄",5,Hace 4 semanas
2,Romina Buendía Basile,Excelente servicio! Mención especial al personal trainer Christian muy amable y servicial! Maquinas modernas y ambiente limpio y ordenado!,5,Hace 4 meses
3,JotaR,"Fui a conocer el gimnasio hace un par de horas y me sorprendió positivamente; en recepción me atendió Christian, me explicó todo a la perfección y fue muy amable. La sala la encontré bastante grande, dividida por grupos, gran variedad de máquinas que se ven modernas y nuevas, otras muchas para cardio, aire acondicionado, buen ambiente. Los vestuarios limpios, tiene sauna funcionando y en breve baño turco. Aproveché oferta con matrícula y llave de acceso gratuitas y una cuota mensual razonable con toalla incluida.",5,Hace 2 meses
4,Olivia,"Estoy pensando en darme de baja aparte de denunciarles de manera formal por no proteger mi privacidad habiéndoles pedido hablar con una chica que hasta con el trípode va a grabar . La primera vez que ocurrió hace unos 2 meses ,mes y medio ,le dije que si le importaba no grabarme cada vez que pasaba por detrás (faltaría más no tener libertad de movimiento ) estoy en un gym no en un plato de televisión ni redes sociales y para mi sorpresa me ha contestado de mala forma. Pedí ayuda a los trabajadores de ahí e hicieron caso omiso.Pedí desde el primer momento hablar con el dueño u encargado sin éxito . Uno de los trabajadores que me conoce me comentó que hablarían con ella porque aunque se pueda grabar (no se puede difundir y eso nadie lo tiene claro ,porque la insistencia de grabar siempre es extraña y seguro que las sube a sus redes ). A mi aparte de mi rostro ,aunque me pixele ,se me reconoce también por mis tatuajes y por mis camisetas que muchas veces llevan mi nombre de usuario de Instagram y dudo mucho que esa persona proteja mi identidad acordé dicta la ley .
Si todo el mundo puede grabar,podría hacer yo también exactamente lo mismo pero yo tengo más clase como para actuar mal por culpa de alguien que desconoce la ley pero ya tiene delito que el gimnasio esté al tanto y no me proteja .
Hoy me he tenido que ir de ahí con un ataque de ansiedad y no es justo !Les comenté en el gimnasio que la ley va por encima de las normas de un gimnasio y que además me sentía ya acosada puesto que cuando me cambio a una máquina ,esa tía va a mi lado o detrás y mirándome siempre mal y desafiante .Yo jamás he tenido ningún conflicto ni nadie se ha quejado por mi ,sin embargo hoy se repitió la situación y pedí ayuda y Dani me comentó que hasta ahora no le llamó la atención .Entonces  que pasa que aquí está permitido el acoso y el incumplimiento constante de la ley ?
Hoy incluso ha entrado al vestuario al minuto de entrar yo para seguirme.Me tengo que dar yo de baja aún siendo yo la cívica ?
Hay unas leyes que cumplir y todos los negocios abiertos al público se rigen por leyes .
A continuación adjunto qué leyes incumple la persona que me graba en este gimnasio y ellos están al tanto .

1. Derecho a la intimidad y a la propia imagen

En España (y también aplicable en la UE):
• Está protegido por el artículo 18 de la Constitución Española, que garantiza el derecho al honor, la intimidad personal y familiar, y la propia imagen.
• También lo regula la Ley Orgánica 1/1982, de protección civil del derecho al honor, a la intimidad personal y familiar y a la propia imagen.

Grabar o fotografiar a alguien sin su consentimiento, en un lugar privado o de acceso restringido como un gimnasio, constituye una intromisión ilegítima en estos derechos.

⸻

2. Ley de Protección de Datos Personales y Garantía de los Derechos Digitales (LOPDGDD)
• Cualquier grabación en la que una persona sea identificable se considera tratamiento de datos personales.
• Si no existe consentimiento expreso ni causa legítima, esa grabación vulnera la Ley Orgánica 3/2018 (LOPDGDD) y el Reglamento General de Protección de Datos (RGPD).

El gimnasio, como responsable del espacio, tiene el deber de proteger la privacidad de los usuarios. Si permite o no actúa ante grabaciones no consentidas, podría incurrir en responsabilidad subsidiaria.

⸻

3. Posible delito (Código Penal)

Si la persona grabó con fines de difundir, acosar o vulnerar tu intimidad, podría encajar en:
• Artículo 197 del Código Penal: castiga la captación o difusión no consentida de imágenes en lugares privados.
• Las penas pueden ir de 1 a 4 años de prisión y multas económicas, dependiendo del uso del material.

Una pena por trabajadores estupendos como CHRISTIAN,SONIA y creo que ÁLVARO  se llama que fue un verdadero placer conocerles y de  Dani me he llevado una sorpresa desagradable al ver que se contradice el mismo una vez diciéndome que hablará con esa chica porque efectivamente la ley me protege y hoy diciendo algo totalmente contradictorio aparte de reconocer que no ha llegado a hablar aún con ella .",1,Hace un mes
5,Javier Forero,Llevo 3 años inscrito y 0 problemas. Suele estar menos concurrido que otros.,5,Hace 3 meses
6,María Carrillo de Albornoz,"Las instalaciones están un poco anticuadas. En cuanto al servicio de entrenamiento personal Santi es el mejor entrenador de allí, adapta los entrenamientos a tus objetivos y hace que cada entrenamiento cuente, además de ser divertido, he progresado mucho con el. Lo recomiendo.",4,Fecha de edición: Hace un mes
7,Valentina Florez Nazzar,"El personal de la tarde es irrespetuoso, especialmente una mujer de cabello rubio. Se acercó a donde estaba, a pedirme de manera grosera, a desmontar un disco que estaba en la máquina y ponerlo literalmente en el otro tubo de alado. Esto debido también alguien que parece del personal, una mujer igual, molestando con los demás de a recepción sobre este tema y haciendo burla de sus clientes. No lo recomiendo para nada, porfavor si estás pensando inscribirte aquí, mejor sáltate esta experiencia.",1,Hace un mes
8,Carol Sánchez,"Me gusta este gym en invierno, ahora en verano no le dan ni al aire. Hace mucho calor y se entrena fatal.

Hay personal super agradable como Juan o la chica de la limpieza de por las mañanas, sin embargo, por otro lado, hay algunos trabajadores sobre todo en el turno de tardes, que no son nada agradables.",1,Hace 4 meses
9,Victor Galan,Menos 5 máquinas nuevas las demás están obsoletas y trilladas todas y los bancos igual como las mancuernas. Las nuevas son muy top pero el resto…. Y por no hablar del personal del gimnasio que tras 8 años entrenando no he visto cosa igual unos bordes chulos cuando están entrenando a chicas que son a las únicas que ayudan al resto nos dicen solo tonterías,1,Hace 4 meses
10,Abel PM,"Gimnasio en mal estado de conservación general, muy lleno de gente, todas las pesas por ahí tiradas, las pantallas apagadas, llenísimo de gente… las duchas están destrozadas, sale muy poca agua, por momentos sale ardiendo y helada. Mala experiencia en general",2,Hace 9 meses
11,will alves,"Excelente gimnasio con equipamientos modernos, sauna y muy buen precio.
Personal trainers te ayudan con las dudas.",5,Hace 5 meses
12,Leonard Floricica,No lo recomiendo los moretones se involucran solo si les das dinero los servicios huelen muy mal y se están muy sucios y a pesar de que hay cuatro aires acondicionados casi nunca los ponen tienes que mendigar para que los conecten una pena manchar el nombre de Cristiano Ronaldo con este gimnasio,1,Hace 2 semanas
13,Daniel Art Achim,Todo fenomenal todo excelente final súper bien pero la música es para cortarte las venas muchas veces deberían de invertir un poco en poner pila los relojes y colocar mejor música para que se anime uno aquí se viene a entrenar no a llorar,4,Hace 3 meses
14,Isabel I ́m saso,"Hola, soy Isabel de @im.saso

Tengo que destacar la simpatía de la recepción. Michel y Dani me aportaron un gran apoyo para entender el manejo, la diversidad de máquinas, clases, salones y zonas para entrenar.

Gracias",5,Fecha de edición: Hace 2 años
15,Maria Ortega,"El gimnasio en sí es bueno, con instalaciones bien equipadas y un ambiente agradable. Sin embargo, la experiencia en la recepción deja que desear. Hay una chica con gafas que no suele ser muy amable, y su actitud no ayuda a crear un ambiente positivo. Sería ideal contar con alguien que refleje el buen espíritu que el resto del equipo ofrece. Con un cambio en la atención al cliente, este lugar sería perfecto.",4,Hace un año
16,Carolina Sánchez-Medina Gómez,"Me gusta el gym, pero no encienden el aire acondicionado, no se puede entrenar si más entrar ya hace calor.",1,Hace 3 meses
17,RAMON MARTINEZ DE ARAGON,"El sitio está bien y los empleados son estupendos... Falta por ARREGLAR el BAÑO TURCO (no lo he visto funcionando nunca). Sale POCA AGUA de las DUCHAS. La SAUNA vuelve a estar BAJA de TEMPERATURA (a 70º -> debería estar en torno a 85º). La MÚSICA suele ser ""MACHACONA"" (de discoteca).",4,Fecha de edición: Hace 5 meses
18,Jesús Arroyo,"Nunca en mi vida había ido a un gimnasio, porque no he sentido la necesidad y la verdad es que no me sentía muy cómodo entre tanta máquina y la gente experta en gimnasios.

Pero un amigo me recomendó hacer ejercicios de fuerza, así que entré a este, cerca de mi casa, y la verdad es que fui con cero expectativas de seguir.

Nada más entrar me dije que iba a durar 3 minutos en un gimnasio, pero tuve la desgracia de toparme con un tipo que se llama Juan que parece salido de una película de Navidad.

Qué persona más atenta, cariñoso, paciente... Yo que estaba deseando seguir con mi planteamiento de cero gimnasio en mi vida, es que le he cogido el gusto a ir por allí a que me ayude con las máquinas y ejercicios.

Por supuesto que voy siempre con él de entrenador personal, y para vergüenza de mis planteamientos anteriores, me saco bonos incluso.

Vamos, que el tipo me ha enganchado y voy todas las semanas.

Pero lo peor no es eso. Es que además me siento mucho mejor y ahora parece que floto por la calle. Quién me ha visto y quién me ve.

Menos mal que Juan está en un gimnasio y no en una inmobiliaria, que si no le compro un piso. Qué bárbaro.

Muy agradecido de verdad al gimnasio, porque personas como yo que nunca los hemos pisado, es justo lo que necesitamos.

Muchas gracias.",5,Hace un año
19,Sergio Guijarro,"Uno de los mejores espacios para entrenar en los que he estado, unos vestuarios muy cuidados y un personal encantador que a parte de recomendarte lo mejor, te da siempre los buenos días 🫶🏽☺️✌🏽🤩…",5,Fecha de edición: Hace 2 años
20,Antoine M,"Normalmente no escribo reseñas, pero esta vez me veo obligado a hacerlo. Fui a preguntar sobre los horarios de las clases y la chica bajita con gafas en la recepción es muy mal educada. Apenas hice una pregunta y me cortó señalando una pantalla, como si no tuviera tiempo para ayudarme. Cuando insistí con otra duda, su actitud fue aún peor.

Después de esta experiencia, revisé las reseñas y descubrí que no soy la única persona que se ha quejado del mal trato en la recepción sobre todo esta chica. Es preocupante que la gerencia no haya hecho nada al respecto. Este gimnasio tiene potencial, pero la actitud de esa chica está espantando a muchos clientes.",1,Hace un año
21,Juampe,"El gimnasio no está mal a nivel de máquinas, pero es un auténtico caos. Nadie hace nada por tener los pesos ordenados o quitar los pesos si se han dejado de utilizar.
Además, el trato en recepción deja que desear y la mujer de la limpieza no para de pasar la fregona aunque haya gente entrenando en esa zona",2,Hace 10 meses
22,Mauricio Marquez,"Laura, la chica con gafas en la recepción, es increíblemente grosera. Siempre tiene malas caras y parece disfrutar de ignorar a los clientes o hablarles con tono borde. Una vez le pedí ayuda y, en lugar de resolver el problema, me respondió de forma fría y despectiva. Además, la he escuchado hablar mal de otros clientes cuando se van. Es inaceptable que alguien así trabaje de cara al público. Si la administración no toma medidas, buscaré otro gimnasio.",1,Hace un año
23,Miguel de Gregorio,"Gimnasio muy recomendable por la calidad/precio y por su personal. Me he tenido que dar de baja después 3 años y medio por motivos de mudanza.

Lo mejor son sus socios y el personal, en particular Cristian, Dani y Hugo, siempre dispuestos a ayudar y de una calidad humana excelente.

El gimnasio tiene muchas máquinas y entrenas fluido incluso en días de mucha afluencia.

Tiene algunos puntos de mejora que espero que trabajen sobre ellos, ya que pasaría de ser un muy buen gimnasio a uno excelente.

Espero que les vaya bien.",5,Hace un año
24,Blanca Lili San Vicente,"Está bien, pero no  me gusta la señora de la limpieza que siempre está limpiando y me quita concentración en mi rutina. Deberían organizar su limpieza para no molestar a los clientes digo que bueno que esté super limpio y le quiera sacar brillo … Ya he estado en otros gym y nunca me había pasado esto.",3,Fecha de edición: Hace un año
25,Troya,siguen cobrando las cuotas a los socios cuando ese gym ya no existe de hace un mes igual que el centro comercial de al lado etc etc... Por qué seguir cobrando el mes entero de noviembre si el 29 octubre paso lo que pasó no pensasteis en bloquear los cobros? Pregunto...Vais a devolver el dinero a todos los socios o os lo vais a quedar también?? Llamas a Madrid a preguntar y te cuelgan el teléfono sin darte una explicación! Incompetentes ojalá perdáis muchos socios por lo que estáis haciendo que bastante tenemos con perder nuestra casa y vehículos y vosotros haciendo estas cosas ojala se sepa! Ya me encargaré de decirlo por las redes sociales!,1,Fecha de edición: Hace 11 meses
26,Mar Pedroviejo,"Excelente relación calidad/precio. Buenas instalaciones y lo mejor de lo mejor los profesores. No se puede ser mejores profesionales, ni más amables. He estado en muchos gimnasios y estos chicos son excepcionales. Muchas gracias a todos!",5,Hace un año
27,nataly pineda,"Me encanta el gimnasio, son súper Majos nonono es que no puedo con tanto 🤪✨…",5,Fecha de edición: Hace un mes
28,Rosa,"TRATO EXCEPCIONAL POR LA SRTA.
SONIA FUENTES PERSONA MUY PROFESIONAL Y CUALIIFICADA
SIEMPRE ESTA AHI ATENTA PARA AYUDAR A TODOS.",5,Hace 5 meses
29,Juan Carlos Diaz Barrio,"Los trabajadores son muy antipático
Y la de la limpieza , no sabe  nada más  que molestar.
Y tampoco es un gimnasio como para que puedan entrenar culturista que presumen ser de alta competicion.
Siempre está lleno de gente y hay que hacer cola para los aparatos .",2,Hace un año
30,jennyfer fernandez,"Llevo un mes apuntada y estoy encantada, tienen buenas maquinas todas en perfecto estado,tienen clases muy variadas, tienen sauna y rayos uva, el trato del personal es buenísimo! Y aunque hay mucha gente entrenando pero se entrena sin tener que esperar demasiado. Muy completo y bien de precio!",5,Hace un año
31,Jani Barrantes,"Es un placer nuevamente dejar una reseña
Con la nueva integrante que tienen en recepción Alba, es una persona muy agradable, carismática, y sobretodo que ayuda y da soluciones a cualquier inquietud que tiene uno.
Al igual que Christian que llevo tiempo entrenando con él,  me a ayudado muchísimo en seguir esforzándome, regresar después de una lesión y que este siempre dispuesto que uno crezca como persona",5,Fecha de edición: Hace 3 semanas
32,nestor pantoja,"Excelente gimnasio, PERO EL ÚNICO PROBLEMA GRABE ES LA MÚSICA DE PASARELA QUE COLOCAN ESTO ES INHUMANO",3,Hace 3 meses
33,Andrés Candela,"Llevo yendo varios años a este gimnasio y nunca he puesto una queja. Sin embargo, en los últimos 2-3 meses me he quejado varias veces en recepción porque todo el gimnasio está ASQUEROSO. Las máquinas, las esterillas, moqueta de la 2ª planta, taquillas, vestuarios, duchas… todo está lleno de porquería y es un auténtico asco la suciedad que hay por todas partes. Entiendo que los monitores y empleados no tienen la culpa, pero desde luego desde la dirección están recortando costes en limpieza y es una vergüenza lo asqueroso que está todo.",1,Hace 2 años
34,Joaquin Lopez,Mi experiencia es inmejorable...el trato en recepcion es maravilloso con Laura que es muy atenta y esta siempre pendiente de los clientes con su simpatia. Ademas los entrenamientos personales son una pasada con Juan que te sabe motivar y saca el  maximo partido. Maxima profesionalidad...,5,Hace 11 meses
35,Keyg Delgado Calderon,"Este gimnasio es maravilloso, con maquinaria de punta , que no la encuentras en otros gimnasios, precios buenos y buen ambiente, lo único que echo de menos, son mancuernas más pesadas , creo que solo las tienen hasta 40 kilos y mantenimiento en una que otra máquina, el resto, genial",5,Hace 10 meses
36,Juan Antonio Alejo,"Buenas instalaciones, precio inmejorable y trato excelente. La cantidad de máquinas también es superior a la de otros gimnasios de la zona, y el horario se adapta a las necesidades de un estudiante como yo, ya que incluso abre los domingos.
También tiene fuente de agua potable dentro, lo que es de agradecer.",5,Hace 2 años
37,Ale935,"Gran gym y Víctor, el personal trainer y jefe, es el mejor. Pregunten por el sobre rutinas si quieres cambiar tu cuerpo.",5,Hace 7 meses
38,Yacknarela Caicedo,"Tengo 4 meses viniendo a este gimnasio y me voy a cambiar simplemente por que hay demasiada gente oliendo malllll , dios mio es una locura no me ha pasado en otros gimnasios solo en este y el olor se mantiene dentro del gym, lastima por que el gym me queda cerca de la casa",1,Hace 8 meses
39,Alba,"Muy bien equipado, tiene máquinas que en otros gimnasios no encuentras.

Personal super amable y te ayudan y explican todo con mucha experiencia.

Lo que no me queda claro es la sauna que creo que no está operativa y según veo en las reseñas había una.",5,Hace un año
40,Javier Parreño Mota,"Excelente gimnasio. Soy socio desde septiembre y estoy muy satisfecho de haber tomado esta decisión. Tanto los monitor@s como las personas de recepción prestan una atención excelente, siempre con amabilidad y predisposición para resolver cualquier duda/inconveniente que te surja. Las instalaciones muy completas y con una limpieza exquisita, además de  tener sauna,  baño turco, gel en las duchas y toallas disponibles. Lo único que echo en falta en las instalaciones es una maquina de remos.  Ha sido un gran acierto el haberme inscrito a este gimnasio.",5,Hace 5 años
41,Abel Cañadilla Fuentes,"El gimnasio CR7 María de Molina es una opción excelente para quienes buscan un espacio moderno y bien equipado para entrenar. Las instalaciones son de primer nivel, con una amplia variedad de máquinas de última tecnología, áreas bien organizadas y espacios amplios tanto para ejercicios de fuerza como para actividades cardiovasculares. Además, ofrecen clases dirigidas.

Uno de los aspectos más destacados es el personal, en particular Cristian, el chico de recepción. Amable y profesional, Cristian se asegura de que cada miembro se sienta bienvenido desde el momento en que entra. Su disposición para ayudar, ya sea respondiendo preguntas o resolviendo cualquier inconveniente, hace que la experiencia sea mucho más cómoda. Siempre con una sonrisa, Cristian crea un ambiente acogedor y positivo, lo que es clave para muchos miembros que valoran no solo la calidad del entrenamiento, sino también el trato personal.

En resumen, el gimnasio CR7 María de Molina no solo destaca por sus instalaciones de primera, sino también por contar con personal como Cristian, quien contribuye a que el servicio sea de gran calidad y la experiencia de los usuarios, excelente.",5,Hace un año
42,gustavo bernal,"He sido socio de CR7 Ciudad Lineal y por motivos empresariales tuvieron que cerrar a principios del mes de junio de este año. A los socios nos informaron del cierre del gimnasio a través de correo electrónico y nos dieron las pautas a seguir para la devolución de las cuotas de los meses que no habíamos podido utilizar debido al cierre. Llevo casi tres meses esperando la devolución de las cuotas que pague por adelantado, y siempre que me pongo en contacto con los responsables solo saben dar largas. Gestión pésima para los antiguos socios que se han visto perjudicados por un cierre y que de momento no han visto como sus cuotas no satisfechas les han sido devueltas. Pésima gestión por parte de los responsables.",1,Hace 2 años
43,Jose Jaime Saborit Zamorano,"El sitio está bien, personal amable en general, salvo uno o dos. Lo que falla sobre todo es la modernidad en comparación con otros gimnasios, por ejemplo no es normal que este gimnasio no disponga de una aplicación que te indique unas rutinas de ejercicio, en la mayoría las hay y hace que uno se pierda con facilidad, otros gimnasios tienen una llave magnética en la que guardas tu progreso en dicha aplicación y este gimnasio no lo tiene. En horas puntas está bastante lleno y hace que, la zona de maquinas y pesas sea algo inaccesible impidiendo hacer tu rutina con comodidad. No está mal por el precio aún así y las clases guiadas están bien.",3,Hace 7 años
44,Rosa Cabanes,"Buen ambiente, buenas instalaciones y diversidad en las clases. Suele estar concurrido según horario, lo normal. Hay bastantes cintas/bicis/elípticas...tampoco suele haber problema de sitio en las clases.  Hay varias zonas para hacer diferentes ejercicios con bastante material, está muy bien. Los monitores son simpáticos y resolutivos.",4,Hace 3 años
45,Gabriela Herrera,"Para el precio que tiene es una pasada. Las instalaciones cuidadas, siempre está todo muy limpio. En los baños hay secador de pelo y jabón en las duchas. Puedes alquilar toallas. Pero lo mejor es el personal, todo el mundo majísimo, siempre buscando un hueco para ayudarte incluso aunque esté todo lleno (especialmente Carlos). Es mi primera vez en un gimnasio, llevo varios meses y estoy encantada.",5,Hace 7 años
46,John,Soy cliente desde hace un año y todo iba más o menos bien hasta este verano. Han subido los precios y bajado los servicios ofrecidos. Ahora nunca hay ni jabón en las duchas y cuando fui a avisarles me dijeron que el jabón era una cortesía. Vaya tela,1,Hace 2 años
47,Maria Bravo De Laguna,"Llevo siendo socia muchos años. Es grande y con muchas maquinas. Lo recomiendo. Lo mejor del gimnasio es Arturo, un entrenador super creativo, siempre te está motivando y adaptándose a tus necesidades. La verdad es que para mí son Arturo el gimnasio no tendría sentido. Me encanta, es súper profesional. Lo recomiendo 100%",5,Hace 2 años
48,Claudia Pérez Calvo,"Llevo años siendo socia del gym y me resulta muy cómodo, con horarios de clases muy bien organizados y el personal siempre me ha tratado con mucho aprecio y amabilidad. Los PTs han sido siempre muy buenos y las clases de zumba y de ciclo son lo más y cañeras. Especialmente, las clases de Arturo son mis favoritas.
Lo recomiendo 100%.",5,Hace 2 años
49,Cristhian Ramos,"Podría ser un buen gimnasio si no fuera porque hay algunos niñatos que se hacen llamar entrenadores y en realidad son unos chulitos que van de sobrados chascando los dedos y creyéndose los dueños y ofendiendo a los clientes, suerte tienen de no estar llenos de hojas de reclamación e incidencias.. decepcionante, (para los dueños) están perdiendo dinero y a los becarios que van de sobrados, un día  se ganan una lección",1,Hace un año
50,Montserrat Mata,"Hace años que acudo a este gimnasio, tienen una gran variedad de clases y sobre todo cuentan con unos grandes profesionales trabajando. En especial Arturo Sisniega, quien no sólo imparte buenas clases sino que corrige posturas y adapta ejercicios si hay alguno que no puedes hacer. Altamente recomendable para los que ya hagan ejercicio y quieran mejorar, o para los que quieran empezar.",5,Hace 2 años
51,David Mateo Merino,"El gym está bien y cubre casi todos los públicos.
Lo malo a mejorar la ventilación y apesta bastante sobre todo apartir de las 17-18, sobre todo en verano cuesta estar dentro con tanta gente y calor",3,Fecha de edición: Hace un año
