id,name,comment,rating,review_date
204,Enrique Alderete,"Buenas tardes

Después de casi 2 años apuntado en este gimnasio, me gustaría comentaros mi experiencia

En primer lugar, no es un Gym barato, se pagan unos 55 euros mensuales siempre que pagues una matricula y te comprometas a estar con ellos al menos 12 meses.

Normalmente, o mejor dicho, casi siempre esta lleno, sobre todo en horario de tarde y fines de semana. Los vestuarios estan limpios pero son excesivamente pequeños para cambiarse, y existiendo piscina, os podeis imaginar lo que supone cambiarse junto a otro cliente en un espacio reducido.

El trato de los monitores de la sala no se corresponde con un gimnasio de ""alta gama"", normalmente están mirando el ordenador y no corrigen a la gente que hace mal los ejercicios, se limitan a entregarte una tabla y poco mas que ""buscate la vida""

Todo esto es ""pasable"" siempre y cuando lo que busques como era mi caso sea un gimnasio que te venga bien por la cercanía a tu trabajo o vivienda

Lo que mas me molesto y por eso NUNCA volveré a este gimnasio ni se lo recomendare a nadie es que, cuando fui a darme de baja, 5 días antes del comienzo del mes de Marzo, me indican en recepción que no es posible, que tengo que pagar todo el mes porque debería haber avisado antes del 16 de Febrero, algo que no entiendo ya que como es posible que te cobren un servicio que no te van a prestar porque has solicitado la baja.

La persona que me atendió, un empleado llamado Manuel Perez, ""coordinador del experiencia del cliente"", no entiendo como pueden llamar al puesto laboral de este señor de esta manera.

En primer lugar al solicitar la baja se negó alegando que como tenia intención de devolver el recibo no me lo tramitaba. Mas  tarde al indicarle que queria poner una reclamacion oficial y al tener que llamar a la policia municipal por no tener hojas de reclamacion oficiales (Autocopiativas) poco mas que me invitó a rellenar de manera manuscrita las 3 hojas.

Al venir la policia municipal y despues de 1 hora de perdida absoluta de tiempo, el ""coordinador de experiencia del cliente"" (jajajaja) entro en razon y realizo una copia de la reclamacion y me solicito la baja para el mes de abril.

Cuando crei que todo habia terminado y despues de devolver el recibo del mes de Marzo que me mandaron al banco, todavia este ""cordinador"" me remite una carta certificada, poco mas que amenazandome con no darme de baja si no estoy al dia de todos los pagos.

Yo tengo pensado reclamar a la OCU por esta clausula del contrato que segun he podido leer en la web puede considerarse como abusiba.

Por todo ello no recomiendo a NADIE que se apunte a este gimnasio, el trato no esta a la altura del precio que se paga.",1,Hace 8 años
205,Carlos G.M.,"Pues fue un poco visita espia la verdad. Quería comparar uno de estos gym propios con los que tienen de suelo del ayuntamiento y gestionan ellos. Y las diferencias son abismales, imagino que como todo en este mundo. Lo que si noté es la presencia de socios, en el de peña grande han metido gente a saco imagino que para amortizar la inversión.  En peña grande no han puesto servicios en la planta de la sala de musculación y según me han dicho ahora han puesto llave en el ascensor. Para que no lo pueda utilizar todo el mundo. Sobre todo lo utilizaban las personas mayores para bajar a los aseos que se encuentran en los vestuarios. - ¿De verdad que no se le ocurrió a nadie, hacer aseos en las plantas superiores? Y obligan a personas mayores a bajar casi cuatro pisos para que puedan miccionar. Creo que llevan al extremo lo de hacer deporte. También me han comentado que han vuelto a cerrar la sauna y el baño turco en Peñagrande para mejorarla.....Otra vez.....debe ser como la cuarta vez y el gym no tiene ni un año. Veis la diferencia entre pagar mucho Y pagar poco. La calidad de los servicios se notan en uno y en otro. Las máquinas estropeada en el de peña grande se tiran con el cartel de fuera de servicio varios días. Y en de Montecarmelo no llegan a las horas, según me han comentado. Y en los dos lados se paga igual, me refiero a dinero no a cantidad......NOVIEMBRE 2019.......Pues si que han tardado en contestar, de todo lo dicho me reitero, me siguen diciendo que el baño turco y la sauna siguen sin funcionar bien, LA ZONA DE SPA se ve que tiene oxido en determinados sitios de la piscina y eso que este verano la cerraron y vaciaron para ponerla a pinto. Cada dos por tres el cartel fuera de servicio esta puesto, tanto en maquinas como en zonas comunes del gym. Ahora estan ampliando la sala  de musculacion, por fin se han dado dado cuenta que si mandan a todo el mundo los mismos ejercicios y solo hay tres maquinas, hay saturacion de medios.....el otro dia uno de los coordinadores entro a la sauna y con la puerta abierta hablando con una persona, la socorrista tres cuarto de los mismos comprobando cada dos por tres si la gente tiene toalla dentra de la sauna, en el limpia vigilando a ver quien hace mal uso del sacador......en fin. Todo muy guay al principio pero ahora como un mal suflee se va desinchando poco a poco.......",2,Fecha de edición: Hace 6 años
206,Cristina Fernández Rivaya,"Estoy encantada en este gimnasio. Es muy grande y tiene una amplísima variedad de clases colectivas muy divertidas, pilates, yoga, bailes de salón... Para todos los gustos. Además hay varios horarios al día de cada y un máximo de alumnos.
En la zona de máquinas, hay tantas cintas, elípticas y bicis que aunque vayas a hora punta siempre tienes alguna libre.
Los entrenadores son muy simpáticos y tienen una paciencia infinita explicándote las tablas y el manejo de las máquinas que te van introduciendo en las mismas.
El Spa está fenomenal, aunque aquí sí suele haber más gente y toca esperar.
Lo único que no me gusta es el párking subterráneo, las plazas son justísimas y hay muy poco espacio de maniobra en general.",4,Hace 12 años
207,Nuria Arroyo Porras,"Experiencia inmejorable. Clases de todo tipo, una sala inmensa con suficientes máquinas para no tener que esperar y atención personalizada. La zona del spa es un punto a favor a tener en cuenta. Siempre me había negado a ir a gimnasios pero llevo 5 meses apuntada a este Go Fit y todavía me pregunto cómo he podido vivir tanto tiempo sin él.",5,Hace 8 años
208,Fernando Bilbao,"Llevo inscrito casi 5 años y considero que hay cosas que han ido empeorando con el tiempo. La mayoría de los días cuesta encontrar una taquilla en los vestuarios sin la cerradura estropeada, masificación en las clases en ciertas horas, últimamente no se repone el gel para higienizar las máquinas antes de cada clase, por no mencionar las constantes obras y reformas que se realizan en vestuarios, spa, etc que dejan las instalaciones bloqueadas durante varios días. Se que es para mejorar las instalaciones, pero se deberían planificar de manera que no afecten tanto a los usuarios. El vestuario masculino lleva panelado y con la puerta principal bloqueada más de una semana... Son detalles que deberían cuidar y que afectan negativamente a la experiencia de los usuarios",3,Hace 9 años
209,VIN,"Es un gimnasio Top con entrenadores que son unos máquinas todos! pero porfavor, arreglad el wifi o permitid que entre algún tipo de conexión a la sala de musculación que parece un búnker soviético encima para lo poco que uso el en el móvil en el gimnasio…
El resto 10/10",5,Hace 2 años
210,Juan Martin,"Una vergüenza y pena en lo que se ha convertido el Gofit de Montecarmelo. Instalaciones cada vez a peor. Quitan actividades cuando les da la gana y no por falta de alumnos sino por interés comercial puro aunque la actividad lleve 8 o 9 años, el profesorado a peor, las taquillas del vestuario masculino llevan rotas meses, la actual dirección de actividades un desastre sin interés por el socio, en fin una pena y vergüenza. Te dicen algo que luego no cumplen. Hay gimnasios mejores en la zona y más baratos. La única opción es irte al Gofit de Majadahonda, este si funciona de maravilla.",1,Fecha de edición: Hace un mes
211,Ratita Sibarita,"Solo uso  la zona de piscinas y spa pero estoy encantada con este GYM. Pago unos 68 euros al mes , más económico que otros Gyms de la zona si decides pagarlos mes a mes. La temperatura del agua de la piscina esta muy agradable y el spa es muy amplio y tiene todo tipo de chorros , baños de burbujas, saunas etc.. No uso el resto de las actividades del gimnasio pero tiene multitud de clases colectivas de las modalidades más punteras!!",5,Hace 11 años
212,Paula Nicolau,"Uno de los mejores gimnasios de Madrid. Tiene clases dirigidas todos los días (hasta los domingos por la mañana y tarde), sala de máquinas amplia y máquinas nuevas y cuidadas. Los monitores son muy majos, te atienden y saben mucho. Piscina interior, spa y box de Cross Fit a parte... Está genial!",5,Fecha de edición: Hace 8 años
213,Carlos miralles romero,"Estuve en este gimnasio cuatro años, en lo que poco a poco se fue convirtiendo en un gimnasio donde se hacia muy dificil aparcar, entrar en clases colectivas y era complicado tener suerte para encontrar una maquina libre. Hasta ahi todo bien, al final lo apaliabas con que hacias ejercicio, te sentias bien y las instalaciones son bastante buenas. Despues de dos años que me di de baja en el gimnasio, por aquel 2015, me inscribo ahora en 2017 en un nuevo Go Fit que van a abrir sus puertas y estoy en los supuestos socios preinscritos. Pues bien, me llama GoFit Montecarmelo diciendo que debo un recibo del 2015. Este fue devuelto por mi banco ya que ellos no causaron mi baja correctamente cuando yo se lo pedi (con mas de un mes de antelación), incluso me hicieron el reembolso de la llave del gimnasio por 10 euros cuando la devolví. Ellos aun asi, me pasaron el recibo. Logicamente este fue devuelto y ahora me exigen que pague este recibo ya que sino no podré inscribirme en el nuevo centro con la oferta para socios preinscritos. Asi que ahora, despues de haber estado cuatro años en este centro pagando una cuota de 70 euros (incluso en meses de vacaciones que no haces uso) , ahora por no haber hecho ellos bien las cosas, me exigen un pago y pierdo el privilegio de ser socio del nuevo centro con los beneficios que ello conlleva. Me esperaba un mucho mejor trato, pero como siempre, al fin y al cabo, somos un numero de socio mas y “los intereses son los intereses”...",1,Hace 8 años
214,Rafael Fernandez,"Cada año se incrementa los cargos como alquiler, toallas, mensualidades. Hay que darle una vuelta a tanta subida sin contraprestación tangible para el abonado",4,Fecha de edición: Hace 7 meses
215,Jose Maria Maurer Somolinos,Gran centro de fitness con multitud de opciones y clases con profesionales monitores. Una zona de Spa y piscina muy buena.,5,Fecha de edición: Hace 8 meses
216,Jose Julio Fernandez Formica,"Hola q tal, yo no conozco a nadie ni escribo por peloteo,solo q la gente q se quiera apuntar este informada.
Muchos tienen miedo ahora con la pandemia contagiarse del covid por eso no se apuntan y lo hacen en casa, pues nada de eso.
Gofit ha tomado unas medidas excelentes,q hace q sea difícil contagiarse .
En la sala pesas las máquinas de correr y todo lo relacionado con cardio, está separado por cabinas con cristaleras y hace q no esté pegado al de al lado y se cojes un cono para q luego venga el de la limpieza a desinfectarlo.
Las máquinas de pesas igual, y te va diciendo en una pantalla si lo haces bien o mal para no lesionarte y las repeticiones q haces
Las clases van por cuadrados y mascarillas, el monitor de sala siempre está para q le preguntes lo q quieras,muy amables . Te regalan una medición corporal con una máquina, y un nutricionista cuando te apuntas valorado todo en 100€.
El ambiente muy sano y el precio merece la pena.
Recomendable 100%
Aquí os dejo unas fotos de con desinfectan can rato y como está el gim",5,Hace 4 años
217,fernando ruiz,"Gym totalmente masificado en horas punta, algunas máquinas anticuadas de Technogym y todas pegadas, además muchas de las cintas de correr están mal ancladas y se mueven, la zona de peso libre un desastre, todas las pesas descolocadas. Buena zona acondicionada para realizar abdomen y ejercicios libres, agradable la luz natural del gym.
En general la gestión de este centro debería mejorar y mucho, yo por ahora me cambio de gimnasio.",3,Hace 8 años
218,Pascual Costanzo,"Yo encuentro las instalaciones aptas higiénicas con buen mantenimiento y muy buena atención del Personal .
Muchas  veces me sorprende la falta de civismo  y de sentido común de los usuarios , en la sala de máquinas gente conversando sentados en las máquinas sin ceder el sito, o en el  vestuario de caballeros muy a menudo veo a los socios usar los secadores ""de pelo "", eléctricos para secar las chanclas , las gafas de piscina y su cuerpo , haciendo un uso abusivo , no pocas veces los dejan en funcionamiento y se van.
Un derroche de energía realmente inexplicable, dudo que hagan eso en sus domicilios con del coste de energía electrica a su cargo.",4,Hace 6 años
219,María Luz Casero del Olmo,"Buenos días, solo comentar q he tenido un trato excepcional en un tema crítico para mi, doy las gracias a David (el de recepcion),por su colaboración y ayuda, quedo muy agradecida.",5,Hace un año
220,Maria Garcia,Instalaciones amplias y muy limpias. Se ve continuamente a personal de limpieza tanto en los vestuarios como repasando las máquinas. La piscina y la zona de spa también muy bien. Tiene servicio de ludoteca para los peques.,5,Fecha de edición: Hace 7 años
221,txapel.etxean,"Cuota de abono alta para los medios que ofrece este gimnasio:
1) La zona de estiramientos de la sala cardio es pequeña y, por lo general, está llena casi siempre.
2) Las pesas de la zona de estiramientos no tienen marcado el pesaje correspondiente, por lo que no sabes el peso con el que estás ejercitándote.
3) Los entrenadores que están en la sala cardio no te asesoran bien sobre la forma correcta de hacer determinados ejercicios o el uso de las máquinas.
4) No hay TRX, el cual encuentras en cualquier otro gimnasio medianamente moderno.
5) La zona de taquillas de los vestuarios masculinos son un desastre: una silla para hasta 6 taquillas, que, por lo general, están ocupadas, y tienes que esperar para cambiarte.
6) Los baños de los vestuarios masculinos están, por lo general, sucios.",1,Hace 3 años
222,Marta Galera Izquierdo,"Instalaciones magnificas se ha sabido adaptar a los tiempos de pandemia.
Las clases dirigidas de lo mejorcito, debido a la calidad de sus profesionales que las imparten. Los monitores que dirigen las actividades dirigidas generan muy buen clima y eso hace que se vaya con regularidad.
La única cosa a mejorar en las clases dirigidas la variedad de la mismas.
Hay muchas clases de adpative strengh y muy pocas de total body o gap.
Las de strengh están muy bien y a mi me gustan y son las más demandadas pero estaría bien que hubiera alguna más de gap o total body.
Escribí esta reseña hace ya un tiempo. Sigo pensando lo mismo, los monitores son excepcionales, pero no hay variedad de clases. Sigue habiendo muchas clases de adaptive strengh y pocas de total body, gap etec. Es importante que hay variedad para que el servicio sea de 10. Si no hay variedad en las clases al final los clientes nos vamos a cansar de las actividades dirigidas. Esto sería una pena porque las actividades dirigidas están fenomenal porque hay grandes profesionales.
Por favor que haya más variedad para que todos podamos disfrutar de todos.",5,Fecha de edición: Hace 4 años
223,Dorile Leon,"Ame este gimnasio, me encanto demasiado, estuve ahí un mes y vamos de maravilla lo único malo es que no tenia abierto Los saunas y tal pero vamos una maravilla de gym si vas entre las 12 y 4 que son horas de comida y esta mas solo las clases ah un 4 de 5 el resto está bien el parking siempre lleno así que ve a esas horas",5,Hace un año
224,Javier García Matallanos,"Gimnasio muy completo tanto en la sala de fitness como la de musculación además de contar gran número de clases colectivas, piscina y spa. El aparcamiento es gratuito siendo socio y al menos a la hora de comer no hay grandes aglomeraciones. Lo único negativo es que tienes que pagar julio y agosto aunque estés de vacaciones o suspender la cuota de esos dos meses en lugar de permitir hacerlo solo julio o agosto según las necesidades o vacaciones del socio en cuestión.",4,Hace 8 años
225,Rafa C R,"El gimnasio esta muy bien. Cuenta con todo tipo de equipamiento para hacer ejercicio, ademas de una piscina estupenda. Las instalaciones estan siempre muy limpias y muy cuidadas. El unico incnveniente es que es un poco caro, comparado con los gimnasios de bajo coste que estan saliendo y que tienen practicamente las mismas cosas. Supongo que bajaran el precio.",3,Hace 12 años
226,Miguel Google,Un buen gimnasio que ha perdido la atención al cliente que tuvo en sus inicios. No fui capaz de hacerme con una factura por tener una cuenta conjunta familiar y perdí una subvención de 300€ por parte de mi empresa. Ningún servicio teléfonico de atención al cliente. Imposible contactar,1,Fecha de edición: Hace 6 años
227,Aleymis Gómez,"El gym esta excelente, en la parte de pesas encuentras todas las máquinas que necesitas, los instructores son muy amables y dispuesto a ayudar siempre. Yo prefiero las clases grupales, y tienen una gran variedad para trabajar lo que desees, aeróbicos, zumba, pilates, yoga, spinning. Además, la zona de jacuzzi y piscina está de lo mejor. La relación precio calidad es justa.",5,Hace 11 años
228,Veronica alaminos aguilar (Verónica),"Las clases de boxeo que es el motivo por el que yo me apunte (lo avisé antes de apuntarme) muy mal, solo hay dos clases a la semana.",1,Hace 9 meses
229,Bruno Mimoso,"Te suben el precio sin aviso. No envían ningún email y dicen que estaba en cartelería.
""Los precios de las diferentes tarifas y/cuotas serán revisables y modificables previo anuncio de GO fit con suficiente antelación, pudiendo el abonado desistir del contrato sin coste alguno
en el plazo de catorce (14) días siguientes a la publicación realizada por el Centro.""
Pides cancelar, te dicen que han puesto el cartel hace mucho tiempo.
El cartel no es válido como comunicación a los clientes. Estos no tienen que ir al centro a leerlo. Deberíais avisar por email o sms pero ni eso.

Son unos tramposos y unos maleducados. Esta mañana me han colgado el teléfono cuando pedí cancelar el contrato.",1,Hace 3 años
230,david LAINEZ,"Cada día está más lleno, y cada día es más difícil entrar en una clase colectiva o hacer máquinas, eso sí, el gimnasio en sí esta muy bien, máquinas bastante nuevas, y bastantes clases colectivas. Pero repito, muy lleno, el parking a partir de la 19h imposible aparcar, los coches mal aparcados por todos los lados.",2,Fecha de edición: Hace 8 años
231,Mery DA,"Genial las clases colectivas, evitando horas punta, claro.
Monitores muy atentos y educados.
WC y duchas muy descuidadas, a veces pasando la línea. Hay poco cuidado  y control en el mantenimiento.",3,Hace 6 años
232,Raul Gomez Del Amo,"Un gym bastante grande . Muy buenas instalaciones y tiene variedad de clases .
En hora punta es difícil entrenar (como todos los gym) tiene 3 parking y una piscina para ti sólo (va muy poca gente )
Eso sí . Si no vas con la oferta de familia sale caro la entrada a este gym .",4,Hace 8 años
233,Pablo,Hay bastante gente pero el sitio está cuidado y relación calidad precio está bien. Lo que no puede ser es que la piscina del spa esté templado tirando a frío.,3,Hace un año
234,Alfonso Alejandre,"Gimnasio impresionante con unas instalaciones excelentes y muchas y variadas actividades. El spa es una maravilla. Por ponerle un par de pegas, la música está muy fuerte en algunas actividades y tiene un ambiente muy individualista, no se fomenta el grupo",4,Hace 4 años
235,Maria Palao,"Grande, agradable, limpio, bonito, bastante lleno y algo caro.

Las clases de pilates son MUY mejorables. No se imparte la disciplina puramente; según la monitora, o tira a fitness de mantenimiento o a yoga, y no respetan lesiones ni siguen progresiones de la disciplina.

Muchas gracias :)",3,Fecha de edición: Hace 6 años
236,david santirso,"Después de 14 años y sigo sin entender el trato que recibo en recepción. Además, de haber firmado este último año el contrato de servicios por lo menos 13 veces.. cada vez que voy el fin de semana al gimnasio me deniegan el acceso y me toca pasar por recepción para firmar otra vez.",1,Hace 2 años
237,David Alonso Rodríguez,"Restaurante que le da un valor añadido al Gym, pero el problema es que la variedad de los platos se centra en la comida con pocas calorías... Vamos, como si toda la gente que fuera al gimnasio se centrara en bajar bajar y bajar kilos.

En cuanto al servicio, no varía mucho, pero cuando lo hace se nota la falta de experiencia de los camareros, pero eso no es malo, porque muchos de ellos lo suplen con un trato cordial y personal.

Creo que si realizaran un cambio en el menú... algo más ibérico...de la tierra, tendrían más éxito.

Yo les pongo un aprobado alto en Calidad/Precio y un suspenso en variedad.

Saludos a tod@s",3,Hace 11 años
238,miguel angel garcia martinez,Instalaciones nuevas. Han adaptado todo el centro a la normativa COVID. La única pega es que hay que dar muchas vueltas al interior. Dispone de aparcamiento tanto exterior como subterráneo. Vestuarios amplios y duchas limpias.,4,Hace 4 años
239,Almudena Priego,"Vestuarios muy fríos que cuando llegas mojada y sudando de la piscina es muy desagradable. No hay enchufes, hay que desenchufar el secador de manos para usar la plancha del pelo y como la encimera está siempre mojada es muy peligroso (lo he reclamado en varias ocasiones y...NI CASO). La zona de spa está muy sucia y descuidada, falta higiene. En la piscina de Aquagim se me han enredado pelos en las piernas en varias ocasiones y una vez saqué un alfiler del suelo....",2,Hace 7 años
240,Alicia Pentenero,Soy abonada de Peñagrande con plan plus y a veces voy a Montecarmelo. Las instalaciones son buenas pero la temperatura es muy caliente. Debería estar un poco mas fresco en verano!,3,Hace 2 años
241,Gema Navarro,"El personal, tanto de sala y como de actividades, son muy profesionales además de agradables, las instalaciones de las salas, baños, todo es de primera, la cafetería variada y saludable. No cambio mi gym por nada, estoy contenta con la elección",5,Hace 2 años
242,Alberto CM,"Tiene las ventajas de estar en las afueras: enorme, parking, diseño  moderno, etc. Tiene muchísimas actividades y la parte spa/piscina está genial. Pero la parte del gimnasio, la veo muy enfocada al público ""amateur"". Mucha cinta y mucha elíptica, pero las máquinas de fuerza son bastante básicas, no aptas para grandes pesos. Pero, sobre todo, no me gusta la parte de peso libre, que para mí es fundamental y realmente es a lo que voy. Primero, en hora punta es muy agobiante. Segundo, hay pocas barras y discos, a veces sencillamente se agotan y tienes que ir mendigándolos. Tercero, hay una cultura del desorden, de dejar todo tirado por ahí y las barras medio montadas, tardas minutos en encontrar dónde está la pareja de tu mancuerna. Cuarto, faltan las máquinas ""de las de verdad"" como una jaula de potencia o un banco de press con topes de seguridad. Para mi esto es clave, porque es lo que no podrías tener en casa y vas al gimnasio para tenerlo. Pero aquí solo hay una medio-jaula de sentadillas que suele estar ocupada. Y 50 bancos de press de banca. Añádele la masificación en horas punta y que los pocos monitores ni se acercan a esta zona. Es curioso porque habría sitio para expandirla, pero parece ser que es mejor poner otras 10 cintas de correr o 5 prensas de pierna más.

Por tanto, no me gusta todo ese ambiente en la zona de pesas y al final voy a cambiar de gimnasio. Es una pena por la piscina y la gran cantidad actividades (que están muy bien), pero por 65 € al mes no puedo aceptar una zona de pesas tan ""de juguete"". Quiero mi barra olímpica. Quiero mi jaula. Y quiero mis dos metros cuadrados para hacer mis ejercicios tranquilamente. Tampoco pido mucho más.

También os diré que para ir en coche está muy bien, pero desde el metro hay un paseo.",3,Hace 8 años
243,Miguel Ángel,"Grandes instalaciones, muy buen trato al cliente por los monitores. Tienen muchas opciones y te personalizan tu rutina, te hacen pesajes y mediciones de grasa mensuales para ver evolución. Tiene muchas salas con actividades y spa y piscina.",5,Hace 4 años
244,I. A,"Mes de agosto 2023. Cobran la misma cuota pero cierran el parking, la piscina y el spa. Muy poca vergüenza. Desde luego voy a ponerles una reclamación.",1,Hace 2 años
245,Sarah De Vicente,Tiene buenas instalaciones pero necesita una renovación. Se nota que es el primero que se abrió. El garaje es demasiado estrecho. Hay que maniobrar para salir con un coche grande.,4,Hace 2 años
